{
  "id": "arxiv-2304.07193",
  "title": "DINOv2: Learning Robust Visual Features without Supervision",
  "titleZh": "DINOv2：无监督学习稳健的通用视觉特征",
  "authors": [
    "Maxime Oquab",
    "Timothée Darcet",
    "Théo Moutakanni",
    "Huy Vo",
    "Marc Szafraniec",
    "Vasil Khalidov",
    "Pierre Fernandez",
    "Daniel Haziza",
    "Francisco Massa",
    "Alaaeldin El-Nouby",
    "Mahmoud Assran",
    "Nicolas Ballas",
    "Wojciech Galuba",
    "Russell Howes",
    "Po-Yao Huang",
    "Shang-Wen Li",
    "Ishan Misra",
    "Michael Rabbat",
    "Vasu Sharma",
    "Gabriel Synnaeve",
    "Hu Xu",
    "Hervé Jegou",
    "Julien Mairal",
    "Patrick Labatut",
    "Armand Joulin",
    "Piotr Bojanowski"
  ],
  "institutions": ["Meta AI Research"],
  "publicationDate": "2023-04-14",
  "year": 2023,
  "doi": "10.48550/arXiv.2304.07193",
  "arxivId": "2304.07193",
  "paperUrl": "https://arxiv.org/abs/2304.07193",
  "codeUrl": "https://github.com/facebookresearch/dinov2",
  "sourceArticleIds": [],
  "sources": [
    { "label": "arXiv 摘要与论文", "url": "https://arxiv.org/abs/2304.07193", "kind": "paper" },
    { "label": "官方代码", "url": "https://github.com/facebookresearch/dinov2", "kind": "code" }
  ],
  "evidenceLevel": "abstract",
  "status": "verified",
  "oneLineSummary": "通过自动筛选的大规模图像数据和稳定的自监督训练，产出无需微调也能跨任务迁移的视觉特征。",
  "task": "视觉表征学习",
  "applicationScenarios": ["图像检索", "分类", "深度估计", "语义分割", "下游视觉特征提取"],
  "problem": "通用视觉特征常依赖文本配对数据或针对下游任务微调，纯视觉自监督在扩大数据和模型规模时又容易不稳定。",
  "coreMethod": "组合并扩展既有自监督学习技术，建立自动化的数据筛选管线，在多源策展图像上训练十亿参数 ViT 教师并蒸馏出较小模型。",
  "valuableInnovations": [
    "把数据自动策展作为视觉基础特征质量的核心环节，而非直接使用未筛选网络数据。",
    "围绕大规模训练的速度和稳定性组合工程改进，并通过蒸馏形成多种尺寸模型。"
  ],
  "keyMetrics": [
    { "name": "最大教师模型规模", "result": "10 亿参数 ViT", "baseline": "蒸馏为一系列更小模型", "source": "arXiv 摘要" }
  ],
  "tags": ["Computer Vision", "Self-supervised", "Representation Learning", "ViT"],
  "modelStructure": "以 Vision Transformer 为主干，最大教师模型约 10 亿参数，并蒸馏到更小的 ViT 变体。",
  "trainingStrategy": "在大规模策展数据上进行自监督预训练，结合加速和稳定训练的多项技术，再执行教师到学生的蒸馏。",
  "dataRecipe": "从多种图像来源自动构建专用、丰富且经过筛选的数据集；摘要未公开全部数据清单。",
  "trainingDatasets": ["自动策展的多源图像数据集（摘要未完整列出）"],
  "testDatasets": ["图像级与像素级多项基准；本卡片未逐表复核"],
  "changesFromPrevious": "相比直接扩大旧有自监督方案，DINOv2同时处理数据策展、训练稳定性、模型规模和蒸馏交付。",
  "openSourceStatus": { "level": "high", "reason": "官方仓库提供多尺寸预训练模型、推理入口和训练代码。" },
  "codeMaturity": { "level": "high", "reason": "官方实现覆盖模型加载、训练与多个下游评估入口。" },
  "reproductionDifficulty": { "level": "high", "reason": "使用权重容易，但完整复现数据策展和十亿参数预训练成本很高。" },
  "computeRequirement": { "level": "high", "reason": "完整预训练涉及大模型和大规模数据；只做特征提取可选择较小权重。" },
  "industrialValue": { "level": "high", "reason": "可作为统一视觉编码器降低多个下游任务分别训练骨干网络的成本。" },
  "commercialValue": { "level": "medium", "reason": "价值依赖下游数据分布、授权要求和相对专用模型的收益。" },
  "limitations": [
    "本卡片仅核对摘要，具体基准数值和数据治理细节仍需阅读全文。",
    "通用特征不等于所有领域都无需微调，长尾与专业图像需单独验证。",
    "完整训练与数据策展的资源门槛高。"
  ],
  "followUpQuestions": [
    "自动策展规则对不同地域和长尾概念是否存在系统偏差？",
    "小模型蒸馏后，哪些像素级任务损失最明显？",
    "在专业工业图像上冻结特征与轻量微调的成本收益如何？"
  ],
  "addedAt": "2026-09-02T00:00:00.000Z",
  "updatedAt": "2026-09-02T00:00:00.000Z",
  "schemaVersion": "1.0.0",
  "generatedBy": "人工核对 arXiv 摘要与官方代码链接"
}
